{
  "$schema": "https://github.com/x-salmon/shellby/blob/main/docs/addon.schema.json",
  "format": 1,
  "id": "keepsakes",
  "name": "Keepsakes",
  "author": "x-salmon",
  "version": "1.0.0",
  "description": "Rewards for the things you do together without Claude: digging up gifts, finishing a set, hide and seek, fetch, growing close, and the crabs who come to chat.",
  "homepage": "https://github.com/x-salmon/shellby",
  "accessories": [
    {
      "id": "sand-pail",
      "name": "Sand Pail",
      "description": "For carrying finds home.",
      "slot": "held",
      "rarity": "common",
      "pivot": [
        3,
        0
      ],
      "unlock": {
        "achievement": "beachcomber"
      },
      "palette": {
        "k": "#8d99ae",
        "K": "#ff9f1c",
        "R": "#ff7a5c",
        "r": "#ffb199",
        "h": "#c9d2de",
        "j": "#5f6a86",
        "L": "#ffd27a",
        "O": "#d4680f",
        "w": "#ffe3d4",
        "D": "#c44a58"
      },
      "pixels": [
        "..hkk..",
        ".h...j.",
        "KLLKKKO",
        ".rwRRD.",
        ".rrRRD.",
        "..RDD.."
      ]
    },
    {
      "id": "metal-detector",
      "name": "Metal Detector",
      "description": "Beep. Beep. BEEP.",
      "slot": "held",
      "rarity": "rare",
      "pivot": [
        1,
        1
      ],
      "unlock": {
        "achievement": "magpie"
      },
      "palette": {
        "k": "#4a4e69",
        "c": "#ffd23f",
        "y": "#fff4b3",
        "g": "#2b2d42",
        "m": "#8d93ad",
        "w": "#ffffff",
        "o": "#e09a1c",
        "O": "#a8641c"
      },
      "pixels": [
        "gg.....",
        ".k.....",
        "..m....",
        "...m...",
        "....k..",
        "...cco.",
        "..cwyco",
        "...ooO."
      ]
    },
    {
      "id": "treasure-chest",
      "name": "Treasure Chest",
      "description": "Where the good finds go.",
      "slot": "shell",
      "rarity": "epic",
      "pivot": [
        3,
        2
      ],
      "unlock": {
        "achievement": "curator"
      },
      "palette": {
        "K": "#5e3a1a",
        "b": "#a0693a",
        "y": "#ffd23f",
        "h": "#cf9259",
        "d": "#7a4a2a",
        "Y": "#c98a12",
        "D": "#3e2620"
      },
      "pixels": [
        ".KhhhK.",
        "KhbybdK",
        "KKKYKKD",
        "KhbbbdK",
        "KKKDDDD"
      ]
    },
    {
      "id": "doubloon-medal",
      "name": "Doubloon Medal",
      "description": "Pirate gold, on a ribbon.",
      "slot": "neck",
      "rarity": "epic",
      "pivot": [
        2,
        0
      ],
      "unlock": {
        "achievement": "x-marks"
      },
      "palette": {
        "r": "#e63946",
        "y": "#ffd23f",
        "Y": "#c99700",
        "R": "#a01f3c",
        "w": "#fff4b3",
        "o": "#e0961c"
      },
      "pixels": [
        "r...R",
        ".r.R.",
        ".wyy.",
        "yyYyo",
        ".yoo."
      ]
    },
    {
      "id": "friendship-locket",
      "name": "Friendship Locket",
      "description": "There is a picture of you inside.",
      "slot": "neck",
      "rarity": "epic",
      "pivot": [
        3,
        0
      ],
      "unlock": {
        "achievement": "best-friends"
      },
      "palette": {
        "g": "#ffd23f",
        "p": "#ff8fab",
        "G": "#c48a14",
        "w": "#ffd9e3",
        "P": "#d4557e",
        "q": "#a33a6a"
      },
      "pixels": [
        "g.....G",
        ".g...G.",
        "..g.G..",
        "..w.p..",
        ".pwppP.",
        "..pPP..",
        "...q..."
      ]
    },
    {
      "id": "leafy-disguise",
      "name": "Leafy Disguise",
      "description": "You will never find him now.",
      "slot": "hat",
      "rarity": "rare",
      "pivot": [
        3,
        4
      ],
      "unlock": {
        "achievement": "peekaboo"
      },
      "palette": {
        "g": "#2a9d8f",
        "G": "#57cc99",
        "L": "#b4e88f",
        "d": "#1f6f74",
        "D": "#18485e"
      },
      "pixels": [
        "..L.G..",
        ".LGgLg.",
        "LGgdGgd",
        ".gdGgd.",
        "ggdddDD"
      ]
    },
    {
      "id": "tennis-ball",
      "name": "Tennis Ball",
      "description": "Throw it. No, really, throw it.",
      "slot": "held",
      "rarity": "common",
      "pivot": [
        1,
        3
      ],
      "unlock": {
        "achievement": "good-arm"
      },
      "palette": {
        "y": "#c7f464",
        "w": "#ffffff",
        "h": "#f0ffa8",
        "d": "#8cc43c",
        "D": "#5a9a46",
        "v": "#d6e6c4"
      },
      "pixels": [
        ".hy.",
        "hwyd",
        "yyvd",
        ".dD."
      ]
    },
    {
      "id": "game-controller",
      "name": "Game Controller",
      "description": "Player two has joined.",
      "slot": "held",
      "rarity": "rare",
      "pivot": [
        1,
        4
      ],
      "unlock": {
        "achievement": "player-two"
      },
      "palette": {
        "K": "#2b2d42",
        "k": "#cfd8dc",
        "r": "#e63946",
        "b": "#3a86ff",
        "g": "#2dc653",
        "L": "#4a4e69",
        "D": "#1a1b2b",
        "w": "#ffffff",
        "s": "#8d99ae"
      },
      "pixels": [
        ".LLLKK.",
        "LwKKKrK",
        "kkkKKKb",
        "KsKKKgK",
        ".DD.DD."
      ]
    },
    {
      "id": "on-air-light",
      "name": "On Air Light",
      "description": "Lit while you talk. He stays shtum.",
      "slot": "hat",
      "rarity": "rare",
      "pivot": [
        3,
        4
      ],
      "unlock": {
        "achievement": "on-air"
      },
      "palette": {
        "K": "#2b2d42",
        "k": "#4a4e69",
        "r": "#e63946",
        "w": "#fff4e4",
        "R": "#ff7a7a",
        "d": "#b0243c",
        "D": "#1a1b2b"
      },
      "pixels": [
        ".kkKKK.",
        "kRRrrrK",
        "KRwrwdK",
        "KrrrddD",
        "..kKD.."
      ]
    },
    {
      "id": "bubble-pipe",
      "name": "Bubble Pipe",
      "description": "Very distinguished. Very bubbly.",
      "slot": "held",
      "rarity": "rare",
      "pivot": [
        6,
        3
      ],
      "unlock": {
        "achievement": "storyteller"
      },
      "palette": {
        "b": "#8a6a4a",
        "w": "#a8dadc",
        "h": "#b8915e",
        "o": "#3a2a2a",
        "d": "#5c4438",
        "W": "#f4ffff"
      },
      "pixels": [
        "....W.w",
        ".....w.",
        "hob..w.",
        "hbdhbbd",
        ".d....."
      ]
    },
    {
      "id": "tin-can-phone",
      "name": "Tin Can Phone",
      "description": "For crab-to-crab calls.",
      "slot": "held",
      "rarity": "common",
      "pivot": [
        1,
        5
      ],
      "unlock": {
        "achievement": "gossip"
      },
      "palette": {
        "K": "#8d99ae",
        "c": "#cfd8dc",
        "s": "#fff4e4",
        "w": "#f4f8fa",
        "d": "#5f6a86",
        "D": "#434a66"
      },
      "pixels": [
        "s....",
        ".s...",
        "..s..",
        "wKK..",
        "KcD..",
        "dDD.."
      ]
    }
  ]
}
